show_id,type,title,director,cast,country,date_added,release_year,rating,duration,listed_in,description
s156,Movie,Into the Void,Greta Gerwig,"Park Bo-gum, Tom Hanks, Cate Blanchett",Spain,"May 1, 2018",2005,G,158 min,"Anime Features, Action & Adventure","Told across sweeping landscapes of 1970s New York, this pulse-pounding saga tracks a exiled prince through loss, revenge, and an unexpected battle for justice."
s157,Movie,Burning Season II,Barry Jenkins,"Meryl Streep, Ryan Gosling, Joaquin Phoenix",United Kingdom,"October 28, 2022",2004,R,90 min,"Dramas, International Movies",A rogue agent navigates the dangerous underbelly of rural France in this darkly comic thriller where the truth comes to light and survival demands everything.
s158,Movie,Crossroads,Martin Scorsese,"Emma Stone, Samuel L. Jackson, Adam Driver",Australia,"July 1, 2022",2000,R,147 min,"LGBTQ Movies, Dramas","Told across sweeping landscapes of futuristic Mumbai, this emotionally charged saga tracks a exiled prince through loss, identity, and an unexpected battle for redemption."
s159,Movie,Fault Lines,Lars von Trier,"Priyanka Chopra, Gemma Chan, Daniel Kaluuya",South Korea,"March 16, 2017",2013,R,70 min,"Horror Movies, Thrillers",A detective navigates the dangerous underbelly of modern Seoul in this pulse-pounding thriller where the truth comes to light and survival demands everything.
s160,Movie,The Underbelly,David Lynch,"Leonardo DiCaprio, Joaquin Phoenix, John David Washington",Germany,"February 9, 2022",2014,PG-13,93 min,"Sci-Fi & Fantasy, Action & Adventure","In the heart of war-torn Beirut, a young woman uncovers a dangerous secret that pulls them into a world of corporate greed. A gripping tale of redemption and betrayal."
s161,Movie,The Negotiator Reborn,Werner Herzog,"Natalie Portman, Daniel Kaluuya, Lupita Nyong'o",United Kingdom,"January 18, 2023",2014,R,136 min,"Horror Movies, International Movies","Set against the vivid backdrop of Tokyo, this pulse-pounding drama follows a rookie cop grappling with betrayal and an unrelenting search for freedom."
s162,Movie,The Summit,Kelly Reichardt,"Denzel Washington, Viola Davis, Chris Pratt",Canada,"November 3, 2020",2002,PG,150 min,"Horror Movies, International Movies","Set against the vivid backdrop of the Arctic, this emotionally charged drama follows a surgeon grappling with justice and an unrelenting search for their family."
s163,Movie,The Outsider Unleashed,Quentin Tarantino,"Adam Driver, Joaquin Phoenix, Chris Pratt",Brazil,"March 5, 2021",1996,TV-MA,83 min,"Music & Musicals, Dramas","A thought-provoking story set in small-town America, following a single father whose life is upended by a catastrophic accident. When old enemies resurface, they must find the strength to fight for redemption."
s164,Movie,The Inside Man 2,Ava DuVernay,"Jennifer Lawrence, Lupita Nyong'o, Amy Adams",Nigeria,"June 13, 2022",2005,NR,76 min,"Music & Musicals, Dramas","When a sudden revelation shakes the foundations of their life, a grieving mother in Los Angeles discovers that old enemies resurface. A critically acclaimed journey of redemption and resilience."
s165,Movie,The Hit List 2,Sofia Coppola,"Anthony Mackie, Morgan Freeman, Denzel Washington",France,"February 21, 2018",2018,R,97 min,"Crime Movies, Thrillers","A pulse-pounding story set in 1970s New York, following a surgeon whose life is upended by a mysterious disappearance. When betrayal strikes from within, they must find the strength to fight for justice."
s166,Movie,End Game,Denis Villeneuve,"Aamir Khan, Meryl Streep, Natalie Portman",Japan,"December 12, 2018",2007,R,117 min,"Music & Musicals, Dramas","After a catastrophic accident, a single father in a remote island is forced to confront a dangerous enemy and risk everything for survival. A pulse-pounding exploration of justice."
s167,Movie,The Iron Fist : Rising,Ryan Coogler,"Deepika Padukone, Adam Driver, Anthony Mackie",United States,"July 1, 2017",2000,PG,143 min,"Action & Adventure, Comedies",A con artist navigates the dangerous underbelly of Tokyo in this thought-provoking thriller where the truth comes to light and survival demands everything.
s168,Movie,Long Shot,Park Chan-wook,"Lupita Nyong'o, Aamir Khan, Zazie Beetz",Nigeria,"November 23, 2019",2017,PG-13,118 min,Stand-Up Comedy,A journalist navigates the dangerous underbelly of small-town America in this heart-wrenching thriller where the stakes become personal and survival demands everything.
s169,Movie,The Verdict : Legacy,Pedro Almodóvar,"Song Kang-ho, Deepika Padukone, Lupita Nyong'o",South Korea,"August 4, 2017",2011,NR,105 min,Documentaries,"After a sudden revelation, a surgeon in modern Seoul is forced to confront a ruthless crime lord and risk everything for survival. A gripping exploration of revenge."
s170,Movie,Shadow Play,Yorgos Lanthimos,"Idris Elba, Aamir Khan, Awkwafina",Brazil,"July 9, 2020",2014,TV-MA,74 min,"Music & Musicals, Dramas",A rookie cop navigates the dangerous underbelly of the Arctic in this emotionally charged thriller where the truth comes to light and survival demands everything.
s171,Movie,Fault Lines,Paul Thomas Anderson,"Jun Ji-hyun, Lupita Nyong'o, Adam Driver",Italy,"September 26, 2023",2001,PG-13,157 min,"Independent Movies, Dramas","A emotionally charged story set in war-torn Beirut, following a rogue agent whose life is upended by a devastating loss. When the truth comes to light, they must find the strength to fight for redemption."
s172,Movie,The Witness,Sofia Coppola,"Tilda Swinton, Robert De Niro, Samuel L. Jackson",Japan,"April 16, 2021",1997,R,157 min,"Documentaries, International Movies",A single father navigates the dangerous underbelly of a remote island in this pulse-pounding thriller where old enemies resurface and survival demands everything.
s173,Movie,Crossroads,Hirokazu Kore-eda,"Gong Yoo, Viola Davis, Robert De Niro",Mexico,"January 2, 2020",2007,PG,96 min,"Documentaries, International Movies","A darkly comic story set in 1970s New York, following a rebel leader whose life is upended by a devastating loss. When the truth comes to light, they must find the strength to fight for freedom."
s174,Movie,Dark Waters,Quentin Tarantino,"Lupita Nyong'o, Robert De Niro, Brad Pitt",Spain,"September 11, 2018",1991,G,156 min,"Sports Movies, Dramas","When a catastrophic accident shakes the foundations of their life, a single father in war-torn Beirut discovers that everything goes wrong. A pulse-pounding journey of betrayal and faith."
s175,Movie,Cold Case : Origins,James Cameron,"Meryl Streep, Idris Elba, Park Bo-gum",India,"July 11, 2022",1998,R,113 min,"Action & Adventure, International Movies","Told across sweeping landscapes of Tokyo, this pulse-pounding saga tracks a exiled prince through loss, betrayal, and an unexpected battle for survival."
s176,Movie,The Forgotten Path,Denis Villeneuve,"Adam Driver, John David Washington, Chris Pratt",United Kingdom,"October 18, 2017",1993,G,154 min,"LGBTQ Movies, Dramas","After a catastrophic accident, a unlikely hero in a remote island is forced to confront a ruthless crime lord and risk everything for survival. A pulse-pounding exploration of survival."
s177,Movie,Double Cross III,Barry Jenkins,"Charlize Theron, Brad Pitt, Ana de Armas",South Korea,"October 20, 2022",1998,G,123 min,Stand-Up Comedy,A young woman navigates the dangerous underbelly of war-torn Beirut in this critically acclaimed thriller where betrayal strikes from within and survival demands everything.
s178,Movie,Fault Lines Uncut,Lars von Trier,"Ana de Armas, Tilda Swinton, Viola Davis",Italy,"June 16, 2018",1990,NR,71 min,"Sports Movies, Dramas","Told across sweeping landscapes of Los Angeles, this emotionally charged saga tracks a scientist through loss, survival, and an unexpected battle for justice."
s179,Movie,Fire and Ash,Hirokazu Kore-eda,"Leonardo DiCaprio, Tom Hanks, Robert De Niro",Brazil,"May 2, 2019",2010,NR,124 min,"Thrillers, International Movies","Set against the vivid backdrop of the Arctic, this visually stunning drama follows a former soldier grappling with justice and an unrelenting search for freedom."
s180,Movie,Smoke Signal : Origins,Denis Villeneuve,"Robert De Niro, Amitabh Bachchan, Park Bo-gum",United States,"August 13, 2019",2014,R,158 min,"Children & Family Movies, Comedies","Set against the vivid backdrop of 1970s New York, this thought-provoking drama follows a scientist grappling with justice and an unrelenting search for justice."
s181,Movie,The Summit II,Yorgos Lanthimos,"Aamir Khan, Zazie Beetz, Gong Yoo",Australia,"February 16, 2020",2018,G,75 min,"Faith & Spirituality, Dramas",A exiled prince navigates the dangerous underbelly of small-town America in this critically acclaimed thriller where the stakes become personal and survival demands everything.
s182,Movie,Echo Chamber,Spike Lee,"Anthony Mackie, Daniel Kaluuya, Ana de Armas",Nigeria,"November 22, 2020",1999,TV-MA,141 min,"Children & Family Movies, Comedies","Set against the vivid backdrop of a remote island, this visually stunning drama follows a scientist grappling with survival and an unrelenting search for redemption."
s183,Movie,Breaking Point,Akira Kurosawa,"John David Washington, Ryan Gosling, Charlize Theron",Germany,"April 27, 2017",2019,TV-MA,126 min,"Classic Movies, Comedies","When a shocking murder shakes the foundations of their life, a rebel leader in Tokyo discovers that loyalties are tested. A heart-wrenching journey of revenge and sanity."
s184,Movie,Desperate Measures 2,Sofia Coppola,"Idris Elba, Zendaya, Jennifer Lawrence",Canada,"May 21, 2021",2003,NR,153 min,"Action & Adventure, Comedies","After a shocking murder, a single father in small-town America is forced to confront a corrupt official and risk everything for justice. A thought-provoking exploration of love."
s185,Movie,The Quiet Storm II,Spike Lee,"Ana de Armas, Robert De Niro, Song Kang-ho",Australia,"November 27, 2023",2008,TV-MA,140 min,"Classic Movies, Comedies","A emotionally charged story set in Los Angeles, following a journalist whose life is upended by a shocking murder. When old enemies resurface, they must find the strength to fight for freedom."
s186,Movie,End Game,Akira Kurosawa,"Tom Hanks, Zazie Beetz, Jun Ji-hyun",United States,"July 25, 2017",1997,R,127 min,"LGBTQ Movies, Dramas","When a sudden revelation shakes the foundations of their life, a rookie cop in 1970s New York discovers that betrayal strikes from within. A thought-provoking journey of redemption and courage."
s187,Movie,Dark Waters,Martin Scorsese,"Michael Fassbender, John David Washington, Robert De Niro",India,"September 11, 2020",2016,NR,147 min,"Documentaries, International Movies",A single father navigates the dangerous underbelly of futuristic Mumbai in this emotionally charged thriller where betrayal strikes from within and survival demands everything.
s188,Movie,Under Pressure 2,François Truffaut,"Daniel Kaluuya, Riz Ahmed, Ali Wong",Brazil,"December 5, 2022",2001,TV-MA,134 min,"Crime Movies, Thrillers",A journalist navigates the dangerous underbelly of futuristic Mumbai in this emotionally charged thriller where the truth comes to light and survival demands everything.
s189,Movie,The Comeback,Sofia Coppola,"Amitabh Bachchan, Michael Fassbender, Emma Stone",Italy,"April 2, 2019",2000,NR,106 min,"LGBTQ Movies, Dramas","Told across sweeping landscapes of the Arctic, this thought-provoking saga tracks a detective through loss, betrayal, and an unexpected battle for freedom."
s190,Movie,The Intruder 2,François Truffaut,"Cate Blanchett, Tom Hanks, Jun Ji-hyun",France,"December 26, 2019",1993,R,118 min,"Action & Adventure, International Movies","In the heart of a remote island, a single father uncovers a dangerous secret that pulls them into a world of crime. A critically acclaimed tale of love and survival."
s191,Movie,Shifting Tides,Steven Soderbergh,"Robert De Niro, Morgan Freeman, Riz Ahmed",Nigeria,"December 6, 2021",1997,G,118 min,"Sci-Fi & Fantasy, Action & Adventure","Told across sweeping landscapes of the Arctic, this thought-provoking saga tracks a detective through loss, redemption, and an unexpected battle for survival."
s192,Movie,Silent Witness,Wes Anderson,"Zazie Beetz, Denzel Washington, Anthony Mackie",India,"May 22, 2020",2012,NR,79 min,"Documentaries, International Movies","After a mysterious disappearance, a surgeon in futuristic Mumbai is forced to confront an unstoppable force and risk everything for the truth. A darkly comic exploration of betrayal."
s193,Movie,Broken Compass,Quentin Tarantino,"John David Washington, Natalie Portman, Deepika Padukone",Mexico,"October 7, 2021",2020,NR,141 min,Stand-Up Comedy,"When a devastating loss shakes the foundations of their life, a young woman in Tokyo discovers that everything goes wrong. A visually stunning journey of revenge and sanity."
s194,Movie,Crimson Tide Rising,Pedro Almodóvar,"Samuel L. Jackson, Ryan Gosling, Anthony Mackie",United Kingdom,"June 27, 2021",2022,R,127 min,"Horror Movies, Thrillers","In the heart of futuristic Mumbai, a former soldier uncovers a dangerous secret that pulls them into a world of crime. A gripping tale of betrayal and survival."
s195,Movie,Vanishing Act,Yorgos Lanthimos,"Jennifer Lawrence, Leonardo DiCaprio, Viola Davis",United Kingdom,"December 18, 2022",2017,G,152 min,"Comedies, Romantic Movies","After a devastating loss, a former soldier in war-torn Beirut is forced to confront a dangerous enemy and risk everything for their family. A heart-wrenching exploration of survival."
s196,Movie,The Long Road Uncut,David Fincher,"Amitabh Bachchan, Denzel Washington, Oscar Isaac",Turkey,"July 1, 2022",1997,G,138 min,"Sports Movies, Dramas","In the heart of war-torn Beirut, a scientist uncovers a dangerous secret that pulls them into a world of supernatural mystery. A emotionally charged tale of betrayal and identity."
s197,Movie,Snowfall,Kelly Reichardt,"Deepika Padukone, Saoirse Ronan, Tom Hanks",Canada,"April 18, 2018",2015,PG-13,139 min,"LGBTQ Movies, Dramas","In the heart of Los Angeles, a former soldier uncovers a dangerous secret that pulls them into a world of political intrigue. A gripping tale of loyalty and revenge."
s198,Movie,Neon Dreams,Steven Soderbergh,"Samuel L. Jackson, Charlize Theron, Julianne Moore",Brazil,"November 14, 2023",2022,PG,88 min,"Faith & Spirituality, Dramas","Set against the vivid backdrop of Tokyo, this thought-provoking drama follows a grieving mother grappling with betrayal and an unrelenting search for freedom."
s199,Movie,Night Owl 2,Akira Kurosawa,"John David Washington, Jennifer Lawrence, Dev Patel",Brazil,"June 11, 2018",2005,PG-13,82 min,"Classic Movies, Dramas",A exiled prince navigates the dangerous underbelly of small-town America in this pulse-pounding thriller where betrayal strikes from within and survival demands everything.
s200,Movie,Free Fall Reborn,David Lynch,"Oscar Isaac, Gong Yoo, Lupita Nyong'o",Germany,"November 24, 2020",2007,PG,116 min,"LGBTQ Movies, Dramas",A scientist navigates the dangerous underbelly of rural France in this heart-wrenching thriller where betrayal strikes from within and survival demands everything.
s201,Movie,The Long Silence : Rising,David Fincher,"Steven Yeun, Joaquin Phoenix, Awkwafina",Turkey,"January 3, 2023",2022,G,150 min,"LGBTQ Movies, Dramas","When an unexpected reunion shakes the foundations of their life, a teacher in rural France discovers that the stakes become personal. A visually stunning journey of revenge and resilience."
s202,Movie,Edge of Tomorrow Uncut,Darren Aronofsky,"Morgan Freeman, Lee Byung-hun, Anthony Mackie",India,"July 3, 2019",2022,NR,71 min,"Anime Features, Action & Adventure","After a shocking murder, a former soldier in rural France is forced to confront a corrupt official and risk everything for justice. A pulse-pounding exploration of justice."
s203,Movie,Last Breath,Park Chan-wook,"Leonardo DiCaprio, Deepika Padukone, Ryan Gosling",United Kingdom,"January 8, 2022",2003,PG-13,136 min,"Crime Movies, Thrillers","When a sudden revelation shakes the foundations of their life, a surgeon in war-torn Beirut discovers that old enemies resurface. A emotionally charged journey of redemption and resilience."
s204,Movie,Point of No Return,Wong Kar-wai,"Gemma Chan, Tom Hanks, Anthony Mackie",Turkey,"July 9, 2018",2023,PG-13,121 min,Documentaries,A teacher navigates the dangerous underbelly of rural France in this critically acclaimed thriller where betrayal strikes from within and survival demands everything.
s205,Movie,Fire and Ash,Wong Kar-wai,"Daniel Kaluuya, Emma Stone, Riz Ahmed",India,"February 27, 2022",2004,PG-13,123 min,"Thrillers, International Movies","A gripping story set in 1970s New York, following a grieving mother whose life is upended by a mysterious disappearance. When loyalties are tested, they must find the strength to fight for freedom."
s206,Movie,The Mole Uncut,Werner Herzog,"Priyanka Chopra, Meryl Streep, Park Bo-gum",Australia,"March 19, 2017",2000,PG,103 min,"Sci-Fi & Fantasy, Thrillers","When an unexpected reunion shakes the foundations of their life, a grieving mother in war-torn Beirut discovers that old enemies resurface. A heart-wrenching journey of survival and faith."
s207,Movie,Double Cross,Kelly Reichardt,"Aamir Khan, Jennifer Lawrence, Zendaya",Mexico,"October 5, 2023",2001,NR,149 min,"Faith & Spirituality, Dramas","Told across sweeping landscapes of modern Seoul, this darkly comic saga tracks a scientist through loss, revenge, and an unexpected battle for redemption."
s208,Movie,Storm Chaser Unleashed,Ingmar Bergman,"Lee Byung-hun, Charlize Theron, Viola Davis",Germany,"October 5, 2017",2001,TV-MA,130 min,"Sci-Fi & Fantasy, Thrillers","Told across sweeping landscapes of small-town America, this gripping saga tracks a former soldier through loss, revenge, and an unexpected battle for their family."
s209,Movie,Thin Ice,Paul Thomas Anderson,"Viola Davis, Michael Fassbender, Gemma Chan",Turkey,"July 16, 2019",1996,PG,124 min,"LGBTQ Movies, Dramas",A journalist navigates the dangerous underbelly of war-torn Beirut in this critically acclaimed thriller where loyalties are tested and survival demands everything.
s210,Movie,The Reckoning,Pedro Almodóvar,"Riz Ahmed, Joaquin Phoenix, Awkwafina",Spain,"December 7, 2023",2010,PG-13,122 min,"Faith & Spirituality, Dramas","When a devastating loss shakes the foundations of their life, a rogue agent in small-town America discovers that loyalties are tested. A emotionally charged journey of revenge and sanity."
s211,Movie,The Final Cut III,Lynne Ramsay,"Idris Elba, John David Washington, Amitabh Bachchan",India,"August 18, 2019",2009,PG-13,143 min,"Horror Movies, Thrillers","Set against the vivid backdrop of futuristic Mumbai, this darkly comic drama follows a young woman grappling with love and an unrelenting search for justice."
s212,Movie,Fractured,David Fincher,"Park Bo-gum, Chris Pratt, Margot Robbie",Mexico,"July 20, 2017",1994,PG,103 min,"Thrillers, International Movies","In the heart of war-torn Beirut, a surgeon uncovers a dangerous secret that pulls them into a world of political intrigue. A gripping tale of redemption and justice."
s213,Movie,Cracked Mirror 2,Chloe Zhao,"Deepika Padukone, Tom Hanks, Morgan Freeman",United Kingdom,"October 2, 2021",2023,PG,159 min,"Sci-Fi & Fantasy, Action & Adventure","A visually stunning story set in 1970s New York, following a con artist whose life is upended by an unexpected reunion. When betrayal strikes from within, they must find the strength to fight for survival."
s214,Movie,Starfall : Rising,Park Chan-wook,"Margot Robbie, Ali Wong, Tom Hanks",France,"May 18, 2022",2012,PG-13,114 min,"Children & Family Movies, Comedies","After a catastrophic accident, a journalist in futuristic Mumbai is forced to confront an unstoppable force and risk everything for redemption. A heart-wrenching exploration of betrayal."
s215,Movie,Long Shot Uncut,Ava DuVernay,"Daniel Kaluuya, Charlize Theron, Joaquin Phoenix",United Kingdom,"August 23, 2020",2020,PG-13,101 min,"Horror Movies, International Movies","In the heart of modern Seoul, a rebel leader uncovers a dangerous secret that pulls them into a world of political intrigue. A critically acclaimed tale of love and revenge."
s216,Movie,Loose Ends,Quentin Tarantino,"Emma Stone, Ali Wong, Amy Adams",India,"February 10, 2020",2011,TV-MA,79 min,"Classic Movies, Comedies","Told across sweeping landscapes of modern Seoul, this thought-provoking saga tracks a rebel leader through loss, survival, and an unexpected battle for freedom."
s217,Movie,Silver Lining Reborn,Mike Leigh,"Tom Hanks, Lee Byung-hun, Awkwafina",United States,"October 8, 2019",1999,G,83 min,"Music & Musicals, Dramas","Told across sweeping landscapes of small-town America, this visually stunning saga tracks a rogue agent through loss, justice, and an unexpected battle for their family."
s218,Movie,Code Red,Quentin Tarantino,"Margot Robbie, Aamir Khan, Gong Yoo",India,"March 19, 2017",2023,R,124 min,"Anime Features, Action & Adventure","After a shocking murder, a scientist in futuristic Mumbai is forced to confront a shadowy organization and risk everything for redemption. A thought-provoking exploration of love."
s219,Movie,Unfinished Business,Wong Kar-wai,"Dev Patel, Jennifer Lawrence, Saoirse Ronan",India,"October 12, 2023",2006,TV-MA,93 min,"Music & Musicals, Dramas","When a devastating loss shakes the foundations of their life, a journalist in modern Seoul discovers that everything goes wrong. A darkly comic journey of love and faith."
s220,Movie,Heat Wave,Steven Spielberg,"Samuel L. Jackson, Tilda Swinton, Jun Ji-hyun",India,"April 22, 2023",1996,PG,104 min,"Music & Musicals, Dramas","Told across sweeping landscapes of Tokyo, this pulse-pounding saga tracks a con artist through loss, revenge, and an unexpected battle for survival."
s221,Movie,The Undertow,Steven Soderbergh,"Daniel Kaluuya, Priyanka Chopra, Brad Pitt",Germany,"May 16, 2019",1993,G,120 min,"Classic Movies, Comedies","In the heart of war-torn Beirut, a rogue agent uncovers a dangerous secret that pulls them into a world of corporate greed. A visually stunning tale of love and identity."
s222,Movie,The Verdict Reborn,Lynne Ramsay,"John David Washington, Viola Davis, Chris Pratt",Mexico,"October 19, 2022",2001,PG-13,106 min,"Classic Movies, Dramas","In the heart of rural France, a teacher uncovers a dangerous secret that pulls them into a world of crime. A pulse-pounding tale of love and revenge."
s223,Movie,River Deep Returns,Ryan Coogler,"John David Washington, Gong Yoo, Saoirse Ronan",Australia,"April 11, 2019",2010,PG-13,153 min,"Faith & Spirituality, Dramas",A surgeon navigates the dangerous underbelly of a remote island in this darkly comic thriller where betrayal strikes from within and survival demands everything.
s224,Movie,Borrowed Time,Wong Kar-wai,"Steven Yeun, Cate Blanchett, Meryl Streep",Italy,"December 23, 2017",2003,R,91 min,"Horror Movies, International Movies",A surgeon navigates the dangerous underbelly of Los Angeles in this heart-wrenching thriller where the stakes become personal and survival demands everything.
s225,Movie,Cracked Mirror,Lars von Trier,"Oscar Isaac, Ryan Gosling, Daniel Kaluuya",Germany,"August 10, 2022",1998,TV-MA,86 min,"LGBTQ Movies, Dramas","Set against the vivid backdrop of war-torn Beirut, this thought-provoking drama follows a rookie cop grappling with redemption and an unrelenting search for survival."
s226,Movie,Code Red,Bong Joon-ho,"John David Washington, Lupita Nyong'o, Saoirse Ronan",Spain,"November 17, 2022",2009,R,114 min,"Sci-Fi & Fantasy, Action & Adventure","Told across sweeping landscapes of war-torn Beirut, this gripping saga tracks a former soldier through loss, loyalty, and an unexpected battle for justice."
s227,Movie,Last Stand Unleashed,Francis Ford Coppola,"Samuel L. Jackson, Adam Driver, Steven Yeun",Spain,"May 16, 2017",2017,TV-MA,107 min,"Horror Movies, International Movies","Told across sweeping landscapes of rural France, this darkly comic saga tracks a young woman through loss, revenge, and an unexpected battle for freedom."
s228,Movie,Lost Signal Returns,Alfonso Cuarón,"Denzel Washington, Julianne Moore, Robert De Niro",France,"October 26, 2023",2007,NR,106 min,"Horror Movies, Thrillers","A thought-provoking story set in a remote island, following a rebel leader whose life is upended by a mysterious disappearance. When everything goes wrong, they must find the strength to fight for justice."
s229,Movie,The Aftermath : Rising,Bong Joon-ho,"Tilda Swinton, Tom Hanks, Ana de Armas",South Korea,"February 6, 2019",2007,NR,86 min,"Independent Movies, Dramas","After a sudden revelation, a journalist in war-torn Beirut is forced to confront a ruthless crime lord and risk everything for freedom. A thought-provoking exploration of love."
s230,Movie,The Comeback II,Denis Villeneuve,"Gong Yoo, Song Kang-ho, Natalie Portman",Spain,"July 25, 2017",2020,PG,93 min,"Action & Adventure, Comedies","Set against the vivid backdrop of modern Seoul, this gripping drama follows a teacher grappling with survival and an unrelenting search for freedom."
s231,Movie,The Silent Hour Unleashed,Federico Fellini,"Charlize Theron, Joaquin Phoenix, Daniel Kaluuya",Brazil,"May 22, 2019",2000,NR,150 min,"Classic Movies, Dramas","Told across sweeping landscapes of the Arctic, this gripping saga tracks a young woman through loss, survival, and an unexpected battle for justice."
s232,Movie,The Silent Hour,Terrence Malick,"Daniel Kaluuya, Amitabh Bachchan, Gemma Chan",India,"October 9, 2017",2015,G,101 min,"Comedies, Dramas","A critically acclaimed story set in Los Angeles, following a con artist whose life is upended by a shocking murder. When the stakes become personal, they must find the strength to fight for survival."
