show_id,type,title,director,cast,country,date_added,release_year,rating,duration,listed_in,description
s233,Movie,Last Stand,François Truffaut,"Deepika Padukone, Lee Byung-hun, Oscar Isaac",Italy,"November 12, 2018",1996,R,86 min,"Anime Features, Action & Adventure","When a sudden revelation shakes the foundations of their life, a exiled prince in modern Seoul discovers that betrayal strikes from within. A gripping journey of revenge and resilience."
s234,Movie,Neon Dreams,Ridley Scott,"Park Bo-gum, Zendaya, Amy Adams",Nigeria,"September 10, 2022",2021,TV-MA,94 min,Stand-Up Comedy,"A pulse-pounding story set in futuristic Mumbai, following a rookie cop whose life is upended by a devastating loss. When everything goes wrong, they must find the strength to fight for the truth."
s235,Movie,Blind Spot : Rising,Ridley Scott,"Park Bo-gum, Denzel Washington, Shah Rukh Khan",Canada,"November 25, 2021",2014,G,93 min,"Horror Movies, International Movies","When a catastrophic accident shakes the foundations of their life, a young woman in futuristic Mumbai discovers that old enemies resurface. A thought-provoking journey of redemption and identity."
s236,Movie,The Promised Land,Alfonso Cuarón,"Brad Pitt, Leonardo DiCaprio, Ali Wong",Brazil,"February 22, 2017",1998,G,92 min,"Horror Movies, International Movies",A rebel leader navigates the dangerous underbelly of a remote island in this emotionally charged thriller where loyalties are tested and survival demands everything.
s237,Movie,The Intruder II,Mike Leigh,"Amy Adams, Zazie Beetz, Leonardo DiCaprio",Australia,"February 16, 2020",1993,TV-MA,116 min,"Dramas, International Movies","In the heart of war-torn Beirut, a grieving mother uncovers a dangerous secret that pulls them into a world of espionage. A heart-wrenching tale of survival and betrayal."
s238,Movie,Heat Wave,Greta Gerwig,"Gong Yoo, Priyanka Chopra, Ali Wong",Japan,"November 17, 2018",2001,NR,141 min,"Sci-Fi & Fantasy, Thrillers","When an unexpected reunion shakes the foundations of their life, a teacher in 1970s New York discovers that old enemies resurface. A heart-wrenching journey of redemption and sanity."
s239,Movie,The Quiet Storm,Ken Loach,"Florence Pugh, Park Bo-gum, Ryan Gosling",Mexico,"August 20, 2019",2010,PG-13,140 min,"Romantic Movies, Dramas","After a catastrophic accident, a single father in futuristic Mumbai is forced to confront a shadowy organization and risk everything for justice. A critically acclaimed exploration of revenge."
s240,Movie,The Revenant Hour : Rising,Ridley Scott,"Meryl Streep, Gong Yoo, Amitabh Bachchan",Nigeria,"January 20, 2021",1998,G,108 min,"Sci-Fi & Fantasy, Action & Adventure","When a devastating loss shakes the foundations of their life, a rookie cop in futuristic Mumbai discovers that everything goes wrong. A pulse-pounding journey of betrayal and humanity."
s241,Movie,Dead Weight,Guillermo del Toro,"Park Bo-gum, Denzel Washington, Ryan Gosling",Italy,"April 8, 2019",2009,TV-MA,81 min,"Music & Musicals, Dramas","After a sudden revelation, a former soldier in a remote island is forced to confront a ruthless crime lord and risk everything for justice. A heart-wrenching exploration of identity."
s242,Movie,Broken Compass Returns,Sofia Coppola,"Lupita Nyong'o, Zazie Beetz, Leonardo DiCaprio",Japan,"July 27, 2020",1997,NR,99 min,"LGBTQ Movies, Dramas","When a shocking murder shakes the foundations of their life, a single father in rural France discovers that the stakes become personal. A visually stunning journey of survival and identity."
s243,Movie,The Inheritance,Bong Joon-ho,"Daniel Kaluuya, Ali Wong, Jun Ji-hyun",United States,"February 17, 2018",2017,R,107 min,"LGBTQ Movies, Dramas","Set against the vivid backdrop of war-torn Beirut, this heart-wrenching drama follows a journalist grappling with revenge and an unrelenting search for redemption."
s244,Movie,Red Line,Christopher Nolan,"Amy Adams, Gong Yoo, Florence Pugh",Japan,"November 13, 2021",2002,TV-MA,141 min,"Sci-Fi & Fantasy, Thrillers","When a devastating loss shakes the foundations of their life, a rookie cop in small-town America discovers that everything goes wrong. A heart-wrenching journey of betrayal and resilience."
s245,Movie,Fault Code Reborn,David Fincher,"Idris Elba, Samuel L. Jackson, Aamir Khan",Japan,"January 21, 2023",2009,PG-13,91 min,Documentaries,"After an unexpected reunion, a con artist in Los Angeles is forced to confront a ruthless crime lord and risk everything for the truth. A heart-wrenching exploration of loyalty."
s246,Movie,The Negotiator,Jean-Luc Godard,"Zazie Beetz, Lee Byung-hun, Joaquin Phoenix",Canada,"August 15, 2017",2011,NR,96 min,"Music & Musicals, Dramas","After a catastrophic accident, a single father in rural France is forced to confront an unstoppable force and risk everything for freedom. A gripping exploration of revenge."
s247,Movie,Killing Time 2,Greta Gerwig,"Meryl Streep, Michael Fassbender, Deepika Padukone",Spain,"August 2, 2022",1990,R,78 min,"Romantic Movies, Dramas","Set against the vivid backdrop of futuristic Mumbai, this heart-wrenching drama follows a journalist grappling with love and an unrelenting search for freedom."
s248,Movie,Crimson Sky,James Cameron,"Jun Ji-hyun, Morgan Freeman, Meryl Streep",Japan,"December 18, 2017",1992,TV-MA,101 min,"Sci-Fi & Fantasy, Thrillers","After a shocking murder, a rogue agent in the Arctic is forced to confront a shadowy organization and risk everything for justice. A emotionally charged exploration of survival."
s249,Movie,Fault Lines Unleashed,Darren Aronofsky,"Dev Patel, Priyanka Chopra, Aamir Khan",South Korea,"March 8, 2019",2015,PG,154 min,"Documentaries, International Movies",A young woman navigates the dangerous underbelly of small-town America in this pulse-pounding thriller where everything goes wrong and survival demands everything.
s250,Movie,Red Line Returns,Jordan Peele,"Deepika Padukone, Ali Wong, Morgan Freeman",Japan,"October 5, 2021",2002,PG-13,87 min,"Dramas, International Movies","After a mysterious disappearance, a surgeon in futuristic Mumbai is forced to confront an unstoppable force and risk everything for their family. A heart-wrenching exploration of redemption."
s251,Movie,The Reckoning,Ava DuVernay,"Lee Byung-hun, Dev Patel, Amy Adams",Mexico,"December 15, 2023",2007,PG,89 min,"Faith & Spirituality, Dramas","Told across sweeping landscapes of modern Seoul, this critically acclaimed saga tracks a single father through loss, survival, and an unexpected battle for freedom."
s252,Movie,White Noise,Spike Lee,"Samuel L. Jackson, Idris Elba, Leonardo DiCaprio",Spain,"August 20, 2022",2013,R,93 min,"Action & Adventure, Comedies",A detective navigates the dangerous underbelly of war-torn Beirut in this darkly comic thriller where the truth comes to light and survival demands everything.
s253,Movie,The Underbelly Returns,Mike Leigh,"Jun Ji-hyun, Ali Wong, Gemma Chan",Canada,"August 11, 2018",2017,G,121 min,"Sports Movies, Dramas","When a shocking murder shakes the foundations of their life, a rebel leader in Tokyo discovers that betrayal strikes from within. A heart-wrenching journey of justice and sanity."
s254,Movie,The Aftermath,Sam Raimi,"Gong Yoo, Michael Fassbender, Zendaya",India,"September 13, 2023",1993,PG-13,94 min,"Documentaries, International Movies","In the heart of small-town America, a unlikely hero uncovers a dangerous secret that pulls them into a world of crime. A gripping tale of redemption and justice."
s255,Movie,Under Pressure,Wes Anderson,"Zendaya, Riz Ahmed, Song Kang-ho",Turkey,"October 25, 2022",1998,R,120 min,"Action & Adventure, International Movies","A heart-wrenching story set in a remote island, following a rookie cop whose life is upended by a sudden revelation. When the stakes become personal, they must find the strength to fight for survival."
s256,Movie,Fog of War Unleashed,Mike Leigh,"Morgan Freeman, Chris Pratt, Steven Yeun",Spain,"December 4, 2020",2013,TV-MA,80 min,"Comedies, Romantic Movies","After a mysterious disappearance, a con artist in rural France is forced to confront a ruthless crime lord and risk everything for their family. A visually stunning exploration of redemption."
s257,Movie,The Promised Land,Hirokazu Kore-eda,"Joaquin Phoenix, Tom Hanks, Zendaya",Germany,"August 24, 2019",2001,PG,85 min,"Music & Musicals, Dramas","A thought-provoking story set in Tokyo, following a surgeon whose life is upended by an unexpected reunion. When the stakes become personal, they must find the strength to fight for their family."
s258,Movie,Heat Wave : Rising,Sofia Coppola,"Julianne Moore, Tilda Swinton, Cate Blanchett",Brazil,"October 20, 2017",2005,PG-13,140 min,"Comedies, Dramas",A detective navigates the dangerous underbelly of rural France in this gripping thriller where the truth comes to light and survival demands everything.
s259,Movie,The Midnight Sun III,Sam Raimi,"Ryan Gosling, Saoirse Ronan, Chris Pratt",Nigeria,"October 10, 2022",2001,NR,128 min,"Dramas, International Movies","Set against the vivid backdrop of 1970s New York, this heart-wrenching drama follows a con artist grappling with identity and an unrelenting search for the truth."
s260,Movie,The Reckoning,Ken Loach,"Zazie Beetz, Viola Davis, Daniel Kaluuya",Australia,"April 17, 2022",2003,G,148 min,"Crime Movies, Thrillers","When an unexpected reunion shakes the foundations of their life, a single father in war-torn Beirut discovers that loyalties are tested. A darkly comic journey of love and sanity."
s261,Movie,Last Stand : Rising,James Wan,"Charlize Theron, Meryl Streep, Zendaya",Brazil,"September 16, 2022",2021,PG,133 min,"Horror Movies, Thrillers",A exiled prince navigates the dangerous underbelly of modern Seoul in this darkly comic thriller where everything goes wrong and survival demands everything.
s262,Movie,The Revenant Hour,Ridley Scott,"Gong Yoo, Tom Hanks, Charlize Theron",Brazil,"December 7, 2019",2006,PG-13,78 min,"Independent Movies, Dramas",A rogue agent navigates the dangerous underbelly of 1970s New York in this gripping thriller where everything goes wrong and survival demands everything.
s263,Movie,The Turning Point Returns,Lynne Ramsay,"Cate Blanchett, Zazie Beetz, Lupita Nyong'o",Mexico,"August 5, 2018",2019,PG-13,138 min,"Classic Movies, Comedies","Set against the vivid backdrop of the Arctic, this gripping drama follows a rebel leader grappling with survival and an unrelenting search for justice."
s264,Movie,Last Breath,Denis Villeneuve,"Lee Byung-hun, Lupita Nyong'o, Song Kang-ho",Nigeria,"September 21, 2023",2000,TV-MA,143 min,"Independent Movies, Dramas","When a devastating loss shakes the foundations of their life, a exiled prince in Tokyo discovers that betrayal strikes from within. A emotionally charged journey of revenge and resilience."
s265,Movie,First Light,Ava DuVernay,"Daniel Kaluuya, Anthony Mackie, Tilda Swinton",South Korea,"March 10, 2017",2013,PG,74 min,"Independent Movies, Dramas","Set against the vivid backdrop of a remote island, this emotionally charged drama follows a rookie cop grappling with love and an unrelenting search for freedom."
s266,Movie,The Last Witness Uncut,Bong Joon-ho,"Jennifer Lawrence, Zendaya, Leonardo DiCaprio",United Kingdom,"December 13, 2023",2023,G,84 min,"Sports Movies, Dramas","After a catastrophic accident, a con artist in war-torn Beirut is forced to confront an unstoppable force and risk everything for the truth. A gripping exploration of identity."
s267,Movie,Crossroads,James Wan,"Dev Patel, Steven Yeun, Anthony Mackie",United Kingdom,"August 25, 2022",1997,PG,104 min,"Action & Adventure, International Movies","After a sudden revelation, a surgeon in the Arctic is forced to confront a corrupt official and risk everything for freedom. A visually stunning exploration of identity."
s268,Movie,Red Signal,Darren Aronofsky,"Cate Blanchett, Brad Pitt, Chris Pratt",United States,"June 20, 2021",2018,PG,76 min,"Dramas, International Movies","A pulse-pounding story set in 1970s New York, following a journalist whose life is upended by a catastrophic accident. When everything goes wrong, they must find the strength to fight for survival."
s269,Movie,Hard Target,Sam Raimi,"Aamir Khan, Deepika Padukone, Song Kang-ho",Italy,"August 25, 2021",1998,NR,81 min,"Anime Features, Action & Adventure","Told across sweeping landscapes of modern Seoul, this critically acclaimed saga tracks a teacher through loss, redemption, and an unexpected battle for survival."
s270,Movie,The Inside Man,Wong Kar-wai,"Zendaya, Morgan Freeman, Michael Fassbender",Italy,"June 28, 2020",2021,G,73 min,"Comedies, Dramas","Told across sweeping landscapes of small-town America, this pulse-pounding saga tracks a single father through loss, betrayal, and an unexpected battle for survival."
s271,Movie,Edge of Tomorrow Unleashed,Spike Lee,"Daniel Kaluuya, Chris Pratt, Denzel Washington",Japan,"September 10, 2020",2015,R,145 min,"Action & Adventure, International Movies",A grieving mother navigates the dangerous underbelly of small-town America in this darkly comic thriller where the stakes become personal and survival demands everything.
s272,Movie,The Turning Point,Greta Gerwig,"John David Washington, Julianne Moore, Lupita Nyong'o",Spain,"October 23, 2023",2021,TV-MA,84 min,"Dramas, International Movies","When a sudden revelation shakes the foundations of their life, a single father in Los Angeles discovers that the stakes become personal. A darkly comic journey of love and courage."
s273,Movie,Hidden Depths,Barry Jenkins,"Chris Pratt, Dev Patel, Ali Wong",Germany,"November 25, 2023",1990,NR,88 min,"Action & Adventure, International Movies","When a sudden revelation shakes the foundations of their life, a young woman in the Arctic discovers that everything goes wrong. A emotionally charged journey of identity and courage."
s274,Movie,Static II,Yorgos Lanthimos,"Steven Yeun, Oscar Isaac, Charlize Theron",Nigeria,"March 13, 2023",2008,PG-13,77 min,"Classic Movies, Dramas","Set against the vivid backdrop of Tokyo, this critically acclaimed drama follows a grieving mother grappling with revenge and an unrelenting search for their family."
s275,Movie,Shadow Play,Francis Ford Coppola,"Adam Driver, Tilda Swinton, Michael Fassbender",Nigeria,"April 18, 2022",2001,PG,130 min,"Sci-Fi & Fantasy, Thrillers","A gripping story set in rural France, following a former soldier whose life is upended by a mysterious disappearance. When the stakes become personal, they must find the strength to fight for their family."
s276,Movie,Dark Passage Reborn,Ingmar Bergman,"Florence Pugh, Steven Yeun, John David Washington",Spain,"November 5, 2023",2016,NR,128 min,"Comedies, Dramas","When a sudden revelation shakes the foundations of their life, a young woman in rural France discovers that betrayal strikes from within. A darkly comic journey of loyalty and identity."
s277,Movie,Fractured,Wong Kar-wai,"Amitabh Bachchan, Viola Davis, Tilda Swinton",Australia,"June 19, 2017",1992,R,142 min,"Classic Movies, Comedies",A surgeon navigates the dangerous underbelly of war-torn Beirut in this thought-provoking thriller where old enemies resurface and survival demands everything.
s278,Movie,Shattered,James Wan,"Daniel Kaluuya, Zendaya, Anthony Mackie",Turkey,"September 21, 2023",2009,G,148 min,"Music & Musicals, Dramas",A single father navigates the dangerous underbelly of the Arctic in this darkly comic thriller where betrayal strikes from within and survival demands everything.
s279,Movie,Cracked Mirror,Lars von Trier,"Michael Fassbender, Jun Ji-hyun, Dev Patel",United States,"October 26, 2019",1993,R,150 min,"Classic Movies, Dramas","A pulse-pounding story set in Los Angeles, following a teacher whose life is upended by a catastrophic accident. When betrayal strikes from within, they must find the strength to fight for the truth."
s280,Movie,Hidden Depths 2,Wes Anderson,"Joaquin Phoenix, Amitabh Bachchan, Natalie Portman",Germany,"February 24, 2021",2001,NR,145 min,"Children & Family Movies, Comedies","In the heart of futuristic Mumbai, a con artist uncovers a dangerous secret that pulls them into a world of supernatural mystery. A gripping tale of love and betrayal."
s281,Movie,Point of No Return,Steven Soderbergh,"Lee Byung-hun, Charlize Theron, Cate Blanchett",India,"August 22, 2022",2000,TV-MA,96 min,"Anime Features, Action & Adventure","In the heart of a remote island, a journalist uncovers a dangerous secret that pulls them into a world of political intrigue. A emotionally charged tale of justice and survival."
s282,Movie,No Man's Land II,Greta Gerwig,"Awkwafina, Priyanka Chopra, Oscar Isaac",Nigeria,"July 17, 2017",2008,R,127 min,"Documentaries, International Movies","Told across sweeping landscapes of war-torn Beirut, this visually stunning saga tracks a single father through loss, identity, and an unexpected battle for their family."
s283,Movie,The Fugitive,James Wan,"Aamir Khan, Tom Hanks, Denzel Washington",United States,"December 22, 2018",2002,PG-13,136 min,"Documentaries, International Movies","A heart-wrenching story set in futuristic Mumbai, following a scientist whose life is upended by a mysterious disappearance. When the stakes become personal, they must find the strength to fight for freedom."
s284,Movie,Parallel Lives III,Bong Joon-ho,"Gemma Chan, Robert De Niro, Chris Pratt",Brazil,"February 20, 2017",2003,NR,146 min,"Action & Adventure, Comedies","After a catastrophic accident, a rookie cop in small-town America is forced to confront a dangerous enemy and risk everything for justice. A pulse-pounding exploration of betrayal."
s285,Movie,Burning Season,Sofia Coppola,"Chris Pratt, Jennifer Lawrence, Cate Blanchett",France,"July 25, 2022",2010,PG,102 min,"Sci-Fi & Fantasy, Action & Adventure","In the heart of a remote island, a former soldier uncovers a dangerous secret that pulls them into a world of crime. A heart-wrenching tale of justice and survival."
s286,Movie,The Summit,Christopher Nolan,"Denzel Washington, Ali Wong, Park Bo-gum",France,"July 18, 2018",1996,NR,126 min,"Action & Adventure, Comedies","Set against the vivid backdrop of Tokyo, this thought-provoking drama follows a teacher grappling with redemption and an unrelenting search for freedom."
s287,Movie,The Long Silence III,Jean-Luc Godard,"Idris Elba, Tom Hanks, Chris Pratt",Australia,"January 19, 2021",2021,R,131 min,"Action & Adventure, Comedies","When a devastating loss shakes the foundations of their life, a teacher in Los Angeles discovers that the truth comes to light. A visually stunning journey of love and identity."
s288,Movie,The Promised Land,David Fincher,"Chris Pratt, Shah Rukh Khan, Samuel L. Jackson",France,"June 28, 2017",2019,NR,107 min,"Crime Movies, Thrillers","In the heart of Los Angeles, a journalist uncovers a dangerous secret that pulls them into a world of crime. A visually stunning tale of justice and betrayal."
s289,Movie,The Long Road : Legacy,Akira Kurosawa,"Awkwafina, John David Washington, Meryl Streep",United States,"December 1, 2021",2005,R,132 min,"Independent Movies, Dramas","In the heart of the Arctic, a detective uncovers a dangerous secret that pulls them into a world of corporate greed. A gripping tale of revenge and betrayal."
s290,Movie,Snowfall,Ava DuVernay,"Daniel Kaluuya, Dev Patel, Leonardo DiCaprio",South Korea,"October 24, 2018",1994,NR,74 min,"Crime Movies, Thrillers","A gripping story set in rural France, following a rebel leader whose life is upended by a catastrophic accident. When the truth comes to light, they must find the strength to fight for freedom."
s291,Movie,The Iron Fist,Alfonso Cuarón,"Florence Pugh, Jennifer Lawrence, Jun Ji-hyun",Brazil,"February 27, 2017",2021,TV-MA,146 min,"Horror Movies, International Movies","After a shocking murder, a rogue agent in Los Angeles is forced to confront an unstoppable force and risk everything for justice. A pulse-pounding exploration of love."
s292,Movie,The Aftermath,Agnès Varda,"Leonardo DiCaprio, Robert De Niro, Brad Pitt",Italy,"July 5, 2018",2013,PG,140 min,"Thrillers, International Movies","After a shocking murder, a single father in 1970s New York is forced to confront a corrupt official and risk everything for justice. A pulse-pounding exploration of loyalty."
s293,Movie,Dust to Dust,Ryan Coogler,"Zazie Beetz, John David Washington, Adam Driver",South Korea,"December 14, 2023",2020,PG,158 min,"Children & Family Movies, Comedies","In the heart of Tokyo, a single father uncovers a dangerous secret that pulls them into a world of corporate greed. A pulse-pounding tale of justice and betrayal."
s294,Movie,Code Red,Park Chan-wook,"Gong Yoo, Priyanka Chopra, Shah Rukh Khan",South Korea,"February 7, 2021",1996,PG-13,149 min,"Sci-Fi & Fantasy, Action & Adventure",A detective navigates the dangerous underbelly of modern Seoul in this heart-wrenching thriller where betrayal strikes from within and survival demands everything.
s295,Movie,Desperate Measures,Lynne Ramsay,"Cate Blanchett, Awkwafina, Julianne Moore",India,"May 12, 2018",2017,PG-13,102 min,"Action & Adventure, Thrillers","In the heart of futuristic Mumbai, a teacher uncovers a dangerous secret that pulls them into a world of supernatural mystery. A heart-wrenching tale of betrayal and survival."
s296,Movie,Ghost Signal,Lynne Ramsay,"Adam Driver, Samuel L. Jackson, Chris Pratt",Turkey,"November 24, 2019",2004,PG-13,84 min,"Romantic Movies, Dramas","After a mysterious disappearance, a scientist in a remote island is forced to confront a shadowy organization and risk everything for freedom. A thought-provoking exploration of loyalty."
s297,Movie,Killing Time,Kathryn Bigelow,"Leonardo DiCaprio, Amitabh Bachchan, Ali Wong",United States,"August 5, 2022",2002,PG-13,150 min,"Sci-Fi & Fantasy, Action & Adventure","Told across sweeping landscapes of Los Angeles, this thought-provoking saga tracks a former soldier through loss, justice, and an unexpected battle for redemption."
s298,Movie,Ghost Signal,Federico Fellini,"Ana de Armas, Emma Stone, Riz Ahmed",Germany,"November 26, 2021",2000,TV-MA,143 min,"Anime Features, Action & Adventure","When a catastrophic accident shakes the foundations of their life, a unlikely hero in Tokyo discovers that old enemies resurface. A darkly comic journey of survival and sanity."
s299,Movie,End Game,Federico Fellini,"Margot Robbie, Daniel Kaluuya, Amitabh Bachchan",Nigeria,"July 1, 2017",1992,NR,130 min,"Horror Movies, Thrillers","After a sudden revelation, a teacher in a remote island is forced to confront a corrupt official and risk everything for freedom. A critically acclaimed exploration of betrayal."
s300,Movie,Crimson Sky,Park Chan-wook,"Ali Wong, Jun Ji-hyun, Riz Ahmed",United States,"November 8, 2017",1991,NR,131 min,"Anime Features, Action & Adventure","Set against the vivid backdrop of rural France, this darkly comic drama follows a teacher grappling with redemption and an unrelenting search for justice."
s301,Movie,Killing Time Uncut,Jean-Luc Godard,"Ali Wong, Emma Stone, Aamir Khan",United Kingdom,"June 23, 2021",1992,R,107 min,Stand-Up Comedy,"After a shocking murder, a rookie cop in the Arctic is forced to confront a shadowy organization and risk everything for redemption. A gripping exploration of love."
s302,Movie,Dust to Dust,Martin Scorsese,"Natalie Portman, Awkwafina, Charlize Theron",Brazil,"March 12, 2022",1994,NR,141 min,"Music & Musicals, Dramas","A critically acclaimed story set in small-town America, following a exiled prince whose life is upended by a catastrophic accident. When everything goes wrong, they must find the strength to fight for their family."
s303,Movie,Red Line Reborn,Yorgos Lanthimos,"Awkwafina, Aamir Khan, Michael Fassbender",Germany,"June 3, 2019",2018,TV-MA,132 min,Stand-Up Comedy,"In the heart of Los Angeles, a rogue agent uncovers a dangerous secret that pulls them into a world of crime. A critically acclaimed tale of justice and betrayal."
s304,Movie,Dust to Dust,Ken Loach,"Meryl Streep, Michael Fassbender, Adam Driver",Brazil,"February 9, 2022",1999,PG,133 min,"LGBTQ Movies, Dramas","A thought-provoking story set in rural France, following a rookie cop whose life is upended by a devastating loss. When the stakes become personal, they must find the strength to fight for the truth."
s305,Movie,Beneath the Ice,Pedro Almodóvar,"Deepika Padukone, Ryan Gosling, Ana de Armas",Mexico,"April 1, 2023",2023,PG-13,152 min,"Sci-Fi & Fantasy, Thrillers","Set against the vivid backdrop of futuristic Mumbai, this thought-provoking drama follows a exiled prince grappling with justice and an unrelenting search for the truth."
s306,Movie,Smoke and Mirrors,Spike Lee,"Dev Patel, Morgan Freeman, Song Kang-ho",Canada,"May 12, 2023",1993,PG-13,88 min,"Classic Movies, Dramas","After a shocking murder, a former soldier in rural France is forced to confront their own demons and risk everything for freedom. A pulse-pounding exploration of redemption."
s307,Movie,Point of No Return,David Lynch,"Awkwafina, Morgan Freeman, Lupita Nyong'o",United Kingdom,"March 12, 2018",1992,PG-13,155 min,"Action & Adventure, Thrillers",A journalist navigates the dangerous underbelly of a remote island in this pulse-pounding thriller where the truth comes to light and survival demands everything.
s308,Movie,The Inheritance Reborn,Martin Scorsese,"Amitabh Bachchan, Charlize Theron, Park Bo-gum",Germany,"May 23, 2020",2008,NR,143 min,"Comedies, Romantic Movies","After a devastating loss, a former soldier in futuristic Mumbai is forced to confront a shadowy organization and risk everything for the truth. A heart-wrenching exploration of identity."
s309,Movie,The Iron Fist : Legacy,Alfonso Cuarón,"Meryl Streep, Viola Davis, Awkwafina",Nigeria,"October 2, 2022",2002,TV-MA,144 min,"Anime Features, Action & Adventure","Set against the vivid backdrop of Los Angeles, this darkly comic drama follows a rebel leader grappling with survival and an unrelenting search for justice."
